{
  "$schema": "https://json-schema.org/draft/2020-12/schema",
  "$id": "https://thebrokenbrain.github.io/drupilot/schemas/catalog.schema.json",
  "title": "drupilot detector catalog (config/catalog/<name>.json)",
  "description": "The common envelope of a detector catalog (hard breaks, the PHPUnit and SimpleTest maps, the Drush and library scans, D7 successors; each arrives with the milestone that uses it). Every entry carries an id, its source and verified; entry-specific fields are free. Only a verified entry that is never verified_as 'announced' may drive a hard gate.",
  "type": "object",
  "required": ["schema_version", "as_of", "catalog", "description", "entries"],
  "additionalProperties": false,
  "properties": {
    "schema_version": {"const": 1},
    "as_of": {"type": "string", "pattern": "^[0-9]{4}-[0-9]{2}-[0-9]{2}$"},
    "catalog": {"description": "The catalog's name: the file's basename.", "type": "string", "pattern": "^[a-z0-9-]+$"},
    "description": {"type": "string", "minLength": 1},
    "entries": {
      "type": "array",
      "items": {
        "type": "object",
        "required": ["id", "src", "verified"],
        "properties": {
          "id": {"type": "string", "pattern": "^[a-z0-9._-]+$"},
          "src": {"type": "string", "minLength": 1},
          "verified": {"type": "boolean"},
          "verified_as": {"enum": ["announced"]},
          "reverify_at": {"type": "array", "minItems": 1, "items": {"type": "string"}},
          "blocking": {"description": "Whether a hit is a hard break (needs verified and never announced).", "type": "boolean"}
        }
      }
    }
  }
}
